{
  "contract": {
    "id": "CT-KNW-001",
    "version": "1.0.0"
  },
  "assembly_id": "KAS-2026-000001",
  "request_id": "REQ-2026-000001",
  "knowledge_set_id": "KS-IMP-001",
  "selected_items": [
    {
      "knowledge_id": "KN-SEO-001",
      "version": "1.0.0",
      "selection_reason": "検索意図分析に必須",
      "required": true,
      "confidence": "high",
      "applicable_sections": [
        "planning"
      ]
    }
  ],
  "rejected_items": [],
  "required_missing_items": [],
  "conflict_records": [],
  "coverage": "sufficient",
  "confidence": "high",
  "assembled_at": "2026-07-16T20:32:00+09:00"
}